"phrase_id","scenario_id","family_id","family_title","family_summary","audio_key","english_text","target_text","canonical_target_text","pronunciation","access_tier","variant_role","context","you_may_hear","search_aliases","warning_note_type","audio_status","emoji","notes","status"
"polite-1","polite-basics","polite-hello","Hello","Use a short greeting before you ask for anything else.","polite-1","Hello","Xin chào","Xin chào","sin chow","starter","say-first","Use this to open a shop, desk, ride, or casual exchange politely.","","hello|hi|greetings","","ready","👋","legacy starter kept as primary | relation-sample=viet-greeting-hello:anchor","approved"
"polite-2","polite-basics","polite-thank-you","Thank you","A short thank-you keeps service moments warm and simple.","polite-2","Thank you","Cảm ơn","Cảm ơn","kahm uhn","starter","say-first","Say this anytime someone helps you, serves you, or gives directions.","","thank you|thanks","","ready","🙏","legacy starter kept as primary","approved"
"polite-thank-you-polite","polite-basics","polite-thank-you","Thank you","A short thank-you keeps service moments warm and simple.","polite-thank-you-polite","Thank you very much","Cảm ơn nhiều","Cảm ơn nhiều","kahm uhn nyew","premium","more-polite","Use this when someone went out of their way for you.","","thank you very much|many thanks","","ready","🙏","premium polite variant","approved"
"polite-3","polite-basics","polite-acknowledge","Yes / okay","This helps you respond respectfully even before you know the full answer.","polite-3","Yes / polite acknowledgment","Dạ","Dạ","yah","starter","say-first","Use this as a soft respectful acknowledgment when someone speaks to you first.","","yes|polite yes|acknowledge","","ready","🙂","legacy starter kept as primary | relation-sample=viet-greeting-acknowledge:anchor","approved"
"polite-4","polite-basics","polite-no-thanks","No, thank you","Short refusal plus thanks is safer than just saying no.","polite-4","No, thank you","Không, cảm ơn","Không, cảm ơn","khong kahm uhn","starter","say-first","Use this to decline offers from vendors or service staff politely.","","no thanks|no thank you","","ready","🙅","legacy starter kept as primary","approved"
"polite-5","polite-basics","polite-excuse-me","Excuse me / sorry","This is the safe all-purpose phrase for passing by, starting a question, or apologizing lightly.","polite-5","Excuse me / sorry","Xin lỗi","Xin lỗi","sin loy","starter","say-first","Use this to get attention, pass by someone, or apologize for a small mistake.","","excuse me|sorry","","ready","🙏","legacy starter kept as primary","approved"
"polite-6","polite-basics","polite-its-okay","It's okay","Use this to lower tension when someone apologizes.","polite-6","It’s okay","Không sao đâu","Không sao đâu","khong sao doh","starter","say-first","Say this when someone apologizes and you want to reassure them.","","it's okay|no problem","","ready","👌","legacy starter kept as primary","approved"
"polite-7","polite-basics","polite-goodbye","Goodbye","A quick goodbye finishes the moment politely without extra talk.","polite-7","Goodbye","Tạm biệt","Tạm biệt","tahm bee-et","starter","say-first","Use this when leaving a shop, café, or hotel desk.","","goodbye|bye","","ready","👋","legacy starter kept as primary","approved"
"problems-2","understanding-repair","repair-understand","I don't understand","Lead with this before you ask for a repeat or a simpler version.","problems-2","I don’t understand","Tôi không hiểu","Tôi không hiểu","toy khong hyew","starter","say-first","Use this when someone is speaking too quickly or using unfamiliar words.","","i don't understand|dont understand|not understand","","ready","🤔","legacy starter moved into repair lane | relation-sample=viet-repair-understand:anchor","approved"
"problems-3","understanding-repair","repair-slower","Speak slower","This is the default repair phrase when the problem is speed, not meaning.","problems-3","Can you speak a little slower?","Nói chậm chút được không?","Nói chậm chút được không?","noy chuhm choot dook khong","starter","say-first","Use this when you need the other person to slow down.","","speak slower|slow down","","ready","🐢","legacy starter moved into repair lane | relation-sample=viet-repair-slower:anchor","approved"
"repair-slower-polite","understanding-repair","repair-slower","Speak slower","This is the default repair phrase when the problem is speed, not meaning.","repair-slower-polite","Could you speak a little slower, please?","Nói chậm giúp tôi được không?","Nói chậm giúp tôi được không?","noy chuhm zoop toy dook khong","premium","more-polite","Use this when you need the same request to sound softer.","","speak slower please","","ready","🐢","premium polite variant | relation-sample=viet-repair-slower:variant:more-polite","approved"
"repair-1","understanding-repair","repair-repeat","Say that again","Use this when you missed the sentence and want the same words again.","repair-1","Please say that again","Làm ơn nói lại","Làm ơn nói lại","lahm uhn noy lie","starter","say-first","Use this when you missed the last sentence and need it repeated.","","say that again|repeat please","","ready","🔁","new starter family | relation-sample=viet-repair-repeat:anchor","approved"
"repair-2","understanding-repair","repair-write-down","Write it down","Written text often rescues numbers, names, and addresses faster than more speech.","repair-2","Please write it down","Viết xuống giúp tôi","Viết xuống giúp tôi","vee-et zoong zoop toy","starter","say-first","Use this for numbers, names, room numbers, or addresses.","I will write it here.","write it down|write please","","ready","✍️","new starter family | relation-sample=viet-repair-write-down:anchor","approved"
"repair-3","understanding-repair","repair-meaning","What does that mean?","Use this when one key word blocks the whole moment.","repair-3","What does that mean?","Cái đó nghĩa là gì?","Cái đó nghĩa là gì?","gai doh ngee-ah lah zee","starter","say-first","Use this when one word or phrase is blocking your understanding.","","what does that mean|meaning","","ready","❓","new starter family","approved"
"repair-4","understanding-repair","repair-which-one","Which one?","This helps when there are two prices, doors, stops, or choices in play.","repair-4","Which one do you mean?","Ý anh/chị là cái nào?","Ý anh/chị là cái nào?","ee anh chee lah gai now","premium","say-first","Use this when there are multiple options and you need the exact one.","","which one|which one do you mean","","ready","🧩","premium-only repair family","approved"
"repair-show-me","understanding-repair","repair-show-me","Show me","Screens, menus, and routes are often easier to show than explain.","repair-show-me","Can you show me?","Chỉ cho tôi được không?","Chỉ cho tôi được không?","chee cho toy dook khong","premium","say-first","Use this when you want the other person to point, show the item, or show the screen.","","show me|can you show me","","ready","🗺️","resolved hold-review primary","approved"
"repair-5","understanding-repair","repair-show-me","Show me","Screens, menus, and routes are often easier to show than explain.","repair-5","Can you show me on the map?","Chỉ trên bản đồ giúp tôi được không?","Chỉ trên bản đồ giúp tôi được không?","chee tren ban doh zoop toy dook khong","premium","also-common","Use this when the route or location is easier to show on a map than say.","","show me on the map|map","","ready","🗺️","resolved hold-review map variant","approved"
"repair-6","understanding-repair","repair-number","Say the number again","This is useful for room numbers, gates, fares, and prices.","repair-6","Please say the number again","Làm ơn nói lại số đó","Làm ơn nói lại số đó","lahm uhn noy lie soh doh","starter","say-first","Use this when you think you missed only the number.","","say the number again|number again","","ready","🔢","resolved hold-review family moved to free | relation-sample=viet-repair-number:anchor","approved"
"repair-number-amount","understanding-repair","repair-number","Say the number again","This is useful for room numbers, gates, fares, and prices.","repair-number-amount","How much did you say?","Anh/chị vừa nói bao nhiêu?","Anh/chị vừa nói bao nhiêu?","anh chee voo-ah noy bao nyew","starter","also-common","Use this when the missed number was the fare, total, room number, or amount.","","how much did you say|what amount","","ready","🔢","resolved hold-review amount variant | relation-sample=viet-repair-number:variant:also-common","approved"
"repair-english-help","understanding-repair","repair-english-help","English help","Switch the conversation toward English when Vietnamese stops working.","repair-english-help","Do you speak English?","Anh/chị nói tiếng Anh không?","Anh/chị nói tiếng Anh không?","anh chee noy tyeng anh khong","starter","say-first","Use this when you need to know whether English is an option.","","speak english|english help","","ready","🗣️","resolved hold-review primary | relation-sample=viet-repair-english-help:anchor","approved"
"repair-english-help-self-limit","understanding-repair","repair-english-help","English help","Switch the conversation toward English when Vietnamese stops working.","repair-english-help-self-limit","Sorry, I don’t speak Vietnamese","Xin lỗi, tôi không nói tiếng Việt","Xin lỗi, tôi không nói tiếng Việt","sin loy toy khong noy tyeng vyet","starter","also-common","Use this after the first phrase when you need to explain the language problem clearly.","","i do not speak vietnamese|no vietnamese","","ready","🗣️","resolved hold-review follow-up | relation-sample=viet-repair-english-help:variant:also-common","approved"
"repair-translate-this","understanding-repair","repair-translate-this","Translate this","Use this when a menu, sign, or screen still needs help.","repair-translate-this","Can you translate this for me?","Dịch giúp tôi cái này được không?","Dịch giúp tôi cái này được không?","zik zoop toy gai nai dook khong","premium","say-first","Use this while showing the menu, sign, receipt, or phone screen.","","translate this|can you translate this","","ready","🌐","resolved hold-review primary","approved"
"taxi-1","transport","transport-destination","Take me here","In most ride situations, the destination is the first sentence that matters.","taxi-1","Take me here","Cho tôi tới đây","Cho tôi tới đây","cho toy toy day","starter","say-first","Use this while showing your destination on your phone.","This entrance or the next one?","take me here|go here|destination","","ready","📍","legacy transport primary | relation-sample=viet-transport-destination:anchor","approved"
"taxi-2","transport","transport-main-destination","Go to this area","Use the place name when it is shorter than a full address.","taxi-2","Go to District 1","Đi quận 1","Đi quận 1","dee gwan mot","starter","say-first","Use this for a simple destination inside the city.","","district 1|go to district 1","","ready","🏙️","legacy transport primary","approved"
"taxi-3","transport","transport-stop-here","Stop here","This is the safe phrase for the last turn or final stop.","taxi-3","You can stop here","Dừng ở đây được rồi","Dừng ở đây được rồi","zoong uh day dook roy","starter","say-first","Use this when you want the driver to stop at the current spot.","","stop here|get off here","","ready","🛑","legacy transport primary | relation-sample=viet-transport-stop-here:anchor","approved"
"transport-stop-here-clearer","transport","transport-stop-here","Stop here","This is the safe phrase for the last turn or final stop.","transport-stop-here-clearer","Please stop right here","Cho tôi xuống ngay đây","Cho tôi xuống ngay đây","cho toy zoong ngay day","premium","clearer","Use this when the driver seems likely to roll past the stop.","","stop right here","","ready","🛑","premium clearer variant | relation-sample=viet-transport-stop-here:variant:clearer","approved"
"taxi-4","transport","transport-route","Go this way","Use this only when you need to redirect the ride, not for every turn.","taxi-4","Go this way","Đi đường này đi","Đi đường này đi","dee doong nai dee","starter","say-first","Use this if you need to guide the driver.","","go this way|this way","","ready","➡️","legacy transport primary","approved"
"taxi-5","transport","transport-aircon","Turn on the AC","This is a small comfort phrase, but it matters on long hot rides.","taxi-5","Please turn on the air conditioning","Mở máy lạnh giúp tôi","Mở máy lạnh giúp tôi","muh mai lanh zoop toy","starter","say-first","Use this on a hot ride if the air conditioning is off.","","air conditioning|aircon","","ready","❄️","legacy transport primary","approved"
"taxi-6","transport","transport-wait","Wait five minutes","Keep this to very short stops so the driver understands the scope.","taxi-6","Wait for me five minutes","Chờ tôi năm phút","Chờ tôi năm phút","cho toy nam foot","starter","say-first","Use this if you need a very short stop.","","wait for me|five minutes","","ready","⏳","legacy transport primary","approved"
"taxi-7","transport","transport-cash","I'll pay cash","This prevents confusion before the ride ends.","taxi-7","I’ll pay cash","Tôi trả bằng tiền mặt","Tôi trả bằng tiền mặt","toy tra bang tyen mat","starter","say-first","Use this when payment method needs to be clear.","","pay cash|cash","","ready","💵","legacy transport primary","approved"
"transport-fare","transport","transport-fare","Fare","Ask the fare directly before the ride moves on.","transport-fare","How much is the fare?","Tiền xe bao nhiêu?","Tiền xe bao nhiêu?","tyen seh bao nyew","starter","say-first","Use this before or during the ride when you need the fare clearly.","Fixed price, not meter.","fare|how much is the fare","","ready","💵","resolved hold-review primary | relation-sample=viet-transport-fare:anchor","approved"
"transport-meter","transport","transport-meter","Use the meter","This helps keep the ride price grounded.","transport-meter","Please use the meter","Làm ơn bật đồng hồ giúp tôi","Làm ơn bật đồng hồ giúp tôi","lahm uhn but dong ho zoop toy","starter","say-first","Use this at the start of the ride when you need the meter running.","","use the meter|meter","","ready","🚕","resolved hold-review primary | relation-sample=viet-transport-meter:anchor","approved"
"transport-lost","transport","transport-lost","We are lost","Use this when the driver and route no longer look right.","transport-lost","I think we are lost","Tôi nghĩ chúng ta bị lạc rồi","Tôi nghĩ chúng ta bị lạc rồi","toy ngee choong ta bee lahk roy","starter","say-first","Use this when the route feels wrong and you need to reset the ride.","","we are lost|i think we are lost","","ready","📍","resolved hold-review primary","approved"
"transport-1","transport","transport-platform","Right platform?","This is the transport recovery phrase when you are not sure you are in the right place.","transport-1","Is this the right platform?","Đây có đúng bến không?","Đây có đúng bến không?","day koh zoong ben khong","premium","say-first","Use this at bus stations, ferry piers, or pickup bays.","","right platform|right bay|right stop","","ready","🚌","premium-only transport family","approved"
"transport-2","transport","transport-bus-goes","Does this bus go here?","This is safer than asking for the whole route story.","transport-2","Does this bus go to…?","Xe này có đi tới… không?","Xe này có đi tới… không?","seh nai koh dee toy khong","premium","say-first","Use this before you board if you are unsure about the route.","","does this bus go to|does this go to","","ready","🚌","premium-only transport family","approved"
"hotel-1","hotel-accommodation","hotel-reservation","I have a reservation","At check-in, reservation first is usually the fastest path.","hotel-1","I have a reservation","Tôi có đặt phòng","Tôi có đặt phòng","toy koh dat fong","starter","say-first","Use this at the desk when you have already booked.","","reservation|booking","","ready","🛎️","legacy hotel primary | relation-sample=viet-hotel-reservation:anchor","approved"
"hotel-2","hotel-accommodation","hotel-check-in","Check in","This is the default phrase when the reservation exists and you need the next step.","hotel-2","I’d like to check in","Cho tôi nhận phòng","Cho tôi nhận phòng","cho toy nyun fong","starter","say-first","Use this when you are ready to begin check-in.","","check in","","ready","🏨","legacy hotel primary | relation-sample=viet-hotel-check-in:anchor","approved"
"hotel-check-in-polite","hotel-accommodation","hotel-check-in","Check in","This is the default phrase when the reservation exists and you need the next step.","hotel-check-in-polite","I’d like to check in, please","Cho tôi nhận phòng nhé","Cho tôi nhận phòng nhé","cho toy nyun fong nhe","premium","more-polite","Use this when you want the request to sound softer at the desk.","","check in please","","ready","🏨","premium polite variant | relation-sample=viet-hotel-check-in:variant:more-polite","approved"
"hotel-3","hotel-accommodation","hotel-checkout-time","Check-out time","This prevents late-checkout surprises.","hotel-3","What time is check-out?","Mấy giờ trả phòng?","Mấy giờ trả phòng?","may zyuh tra fong","starter","say-first","Ask this early so you know the deadline before your last day.","","check out time|checkout","","ready","🕒","legacy hotel primary | relation-sample=viet-hotel-checkout-time:anchor","approved"
"hotel-quiet-room","hotel-accommodation","hotel-quiet-room","Quiet room","Use this when the room location matters as much as the room itself.","hotel-quiet-room","Can I have a quiet room?","Cho tôi phòng yên tĩnh được không?","Cho tôi phòng yên tĩnh được không?","cho toy fong yen tinh dook khong","premium","say-first","Use this when you need a quieter room away from traffic, elevators, or noise.","","quiet room","","ready","😴","resolved hold-review primary","approved"
"hotel-checkout","hotel-accommodation","hotel-checkout","Check out now","Use this when you are ready to finish the stay, not just ask about the time.","hotel-checkout","I’d like to check out","Cho tôi trả phòng","Cho tôi trả phòng","cho toy tra fong","starter","say-first","Use this at the desk when you are ready to end the stay.","","check out now|i'd like to check out","","ready","🛎️","resolved hold-review primary","approved"
"hotel-4","hotel-accommodation","hotel-room-hot","Room too hot","Lead with the room problem before asking for the fix.","hotel-4","This room is too hot","Phòng này nóng quá","Phòng này nóng quá","fong nai nong gwah","starter","say-first","Use this when the room temperature is the main problem.","","room too hot|too hot","","ready","🥵","legacy hotel primary | relation-sample=viet-hotel-room-hot:anchor","approved"
"hotel-5","hotel-accommodation","hotel-aircon-broken","AC not working","This is the more specific follow-up when the heat problem is the air conditioner.","hotel-5","The air conditioner isn’t working","Máy lạnh không chạy","Máy lạnh không chạy","mai lanh khong chai","starter","say-first","Use this when the air conditioner is not working at all.","","air conditioner isn't working|aircon broken","","ready","🧊","legacy hotel primary | relation-sample=viet-hotel-aircon-broken:anchor","approved"
"hotel-6","hotel-accommodation","hotel-more-supplies","More room supplies","Use this when you need more basics for the room.","hotel-6","More towels please","Cho tôi thêm khăn","Cho tôi thêm khăn","cho toy them khan","starter","say-first","Use this for a straightforward front-desk request for more room supplies.","","more towels|towels","","ready","🧺","resolved hold-review family broadened","approved"
"hotel-more-supplies-paper","hotel-accommodation","hotel-more-supplies","More room supplies","Use this when you need more basics for the room.","hotel-more-supplies-paper","Can I have more toilet paper?","Cho tôi thêm giấy vệ sinh được không?","Cho tôi thêm giấy vệ sinh được không?","cho toy them zai veh sinh dook khong","starter","also-common","Use this when the room needs more toilet paper rather than more towels.","","more toilet paper|room supplies","","ready","🧺","resolved hold-review supply variant","approved"
"hotel-7","hotel-accommodation","hotel-luggage","Hold my luggage","This is a common before-check-in or after-checkout phrase.","hotel-7","Please hold my luggage","Giữ hành lý giúp tôi","Giữ hành lý giúp tôi","zoo han lee zoop toy","starter","say-first","Use this when you need the hotel to hold your bags for a while.","","hold my luggage|bags","","ready","🧳","legacy hotel primary","approved"
"hotel-8","hotel-accommodation","hotel-key-card","Key card not working","Use this when the key card will not open the room.","hotel-8","The key card doesn’t work","Thẻ phòng không mở được","Thẻ phòng không mở được","teh fong khong muh dook","premium","say-first","Use this when the room card stops working.","","key card doesn't work|room card","","ready","🪪","premium-only hotel family","approved"
"hotel-9","hotel-accommodation","hotel-call-taxi","Call a taxi","This is a practical second sentence, not a brand-new category.","hotel-9","Can you call a taxi for me?","Gọi taxi giúp tôi được không?","Gọi taxi giúp tôi được không?","goy taxi zoop toy dook khong","premium","say-first","Use this when you want the hotel to arrange a ride instead of just giving directions.","","call a taxi|call car","","ready","🚕","premium-only hotel family","approved"
"coffee-1","food-drink","food-coffee-milk","Iced milk coffee","Start with the base drink before you add any small changes.","coffee-1","One iced milk coffee please","Cho tôi một cà phê sữa đá","Cho tôi một cà phê sữa đá","cho toy mot ka feh sue-ah dah","starter","say-first","Use this at a café when you want the classic Vietnamese coffee order.","","iced milk coffee|coffee with milk","","ready","☕","legacy food primary","approved"
"coffee-2","food-drink","food-coffee-black","Iced black coffee","Keep the order short and direct at busy counters.","coffee-2","I’d like an iced black coffee","Cho tôi cà phê đen đá","Cho tôi cà phê đen đá","cho toy ka feh den dah","starter","say-first","Use this when you want coffee without milk.","","iced black coffee|black coffee","","ready","🫗","legacy food primary","approved"
"coffee-3","food-drink","food-coffee-bac-xiu","Bac xiu","This is the sweeter milk-heavy coffee option many travelers ask for.","coffee-3","I’d like an iced bạc xỉu","Cho tôi bạc xỉu đá","Cho tôi bạc xỉu đá","cho toy bahk see-u dah","starter","say-first","Use this when you want a sweeter milk-forward coffee.","","bac xiu|bạc xỉu","","ready","🥛","legacy food primary","approved"
"coffee-4","food-drink","food-less-ice","Less ice","Use the base request first, then add this if you need it.","coffee-4","Just a little ice","Ít đá thôi","Ít đá thôi","eet dah toy","starter","say-first","Add this when you want less ice in your drink.","","less ice|little ice","","ready","🧊","legacy food primary","approved"
"coffee-5","food-drink","food-no-sugar","No sugar","This is one of the most useful café follow-ups for travelers.","coffee-5","No sugar please","Không đường nhé","Không đường nhé","khong doong nhe","starter","say-first","Use this to keep your drink less sweet.","","no sugar","","ready","🚫","legacy food primary","approved"
"coffee-6","food-drink","food-to-go","To go","This keeps the order atomic and easy to recognize.","coffee-6","To go","Mang đi","Mang đi","mang dee","starter","say-first","Say this when you want takeaway instead of staying.","","to go|take away|takeout","","ready","🥤","legacy food primary","approved"
"coffee-7","food-drink","food-pay-now","Ready to pay","Use this to move the counter moment forward without extra explanation.","coffee-7","Please let me pay","Tính tiền giúp tôi","Tính tiền giúp tôi","ting tyen zoop toy","starter","say-first","Use this when you are ready to pay at the counter.","","let me pay|pay now","","ready","💵","legacy food primary | relation-sample=viet-food-pay-now:anchor","approved"
"food-need-table","food-drink","food-need-table","Table for two","Use this when you need seating before anything else.","food-need-table","A table for two, please","Cho tôi bàn cho hai người nhé","Cho tôi bàn cho hai người nhé","cho toy ban cho hai ngwee nhe","starter","say-first","Use this when the first need is getting seated.","","table for two|need a table","","ready","🪑","resolved hold-review primary | relation-sample=viet-food-need-table:anchor","approved"
"food-menu","food-drink","food-menu","See the menu","Use this when the next step is reading the options, not ordering yet.","food-menu","Can I see the menu?","Cho tôi xem thực đơn được không?","Cho tôi xem thực đơn được không?","cho toy sem thook dun dook khong","starter","say-first","Use this before ordering when you still need the menu.","","see the menu|menu","","ready","📋","resolved hold-review primary | relation-sample=viet-food-menu:anchor","approved"
