"phrase_id","scenario_id","family_id","family_title","family_summary","audio_key","english_text","target_text","canonical_target_text","pronunciation","access_tier","variant_role","context","you_may_hear","search_aliases","warning_note_type","audio_status","emoji","notes","status"
"v900-dire-navi-is-it-behind-this-building","directions-navigation","v900-dire-navi-is-it-behind-this-building","Is it behind this building","Ask this when you need is it behind this building.","v900-dire-navi-is-it-behind-this-building","Is it behind this building?","Nó có ở phía sau tòa nhà này không?","Nó có ở phía sau tòa nhà này không?","No co o phia sau toa nha nay khong","premium","say-first","Use this while walking, checking a route, or confirming the exact turn, stop, or entrance.","","is it behind this building?|is it behind this building","","ready","🗺️","cleanup import: Directions & Places / Landmarks & Places / keep_as_is; selected as 900 premium fill","approved"
"v900-dire-navi-is-this-the-correct-street","directions-navigation","v900-dire-navi-is-this-the-correct-street","Is this the correct street","Ask this when you need is this the correct street.","v900-dire-navi-is-this-the-correct-street","Is this the correct street?","Đây có phải là đường phố chính xác không?","Đây có phải là đường phố chính xác không?","Day co phai la duong pho chinh xac khong","premium","say-first","Use this while walking, checking a route, or confirming the exact turn, stop, or entrance.","","is this the correct street?|is this the correct street","","ready","🗺️","cleanup import: Directions & Places / Landmarks & Places / keep_as_is; selected as 900 premium fill","approved"
"v900-dire-navi-where-is-the-back-entrance","directions-navigation","v900-dire-navi-where-is-the-back-entrance","Where is the back entrance","Ask this when you need where is the back entrance.","v900-dire-navi-where-is-the-back-entrance","Where is the back entrance?","Lối vào phía sau ở đâu?","Lối vào phía sau ở đâu?","Loi vao phia sau o dau","premium","say-first","Use this while walking, checking a route, or confirming the exact turn, stop, or entrance.","","where is the back entrance?|where is the back entrance","","ready","🗺️","cleanup import: Directions & Places / Entrances, Exits & Pickup Points / keep_as_is; selected as 900 premium fill","approved"
"v900-dire-navi-where-is-the-main-entrance","directions-navigation","v900-dire-navi-where-is-the-main-entrance","Where is the main entrance","Ask this when you need where is the main entrance.","v900-dire-navi-where-is-the-main-entrance","Where is the main entrance?","Lối vào chính ở đâu?","Lối vào chính ở đâu?","Loi vao chinh o dau","premium","say-first","Use this while walking, checking a route, or confirming the exact turn, stop, or entrance.","","where is the main entrance?|where is the main entrance","","ready","🗺️","cleanup import: Directions & Places / Asking Where / keep_as_is; selected as 900 premium fill","approved"
"v900-dire-navi-where-is-the-ticket-office","directions-navigation","v900-dire-navi-where-is-the-ticket-office","Where is the ticket office","Ask this when you need where is the ticket office.","v900-dire-navi-where-is-the-ticket-office","Where is the ticket office?","Phòng bán vé ở đâu?","Phòng bán vé ở đâu?","Phong ban ve o dau","premium","say-first","Use this while walking, checking a route, or confirming the exact turn, stop, or entrance.","","where is the ticket office?|where is the ticket office","","ready","🗺️","cleanup import: Directions & Places / Asking Where / keep_as_is; selected as 900 premium fill","approved"
"v900-dire-navi-where-is-the-train-station","directions-navigation","v900-dire-navi-where-is-the-train-station","Where is the train station","Ask this when you need where is the train station.","v900-dire-navi-where-is-the-train-station","Where is the train station?","Nhà ga xe lửa ở đâu?","Nhà ga xe lửa ở đâu?","Nha ga xe lua o dau","premium","say-first","Use this while walking, checking a route, or confirming the exact turn, stop, or entrance.","","where is the train station?|where is the train station","","ready","🗺️","cleanup import: Directions & Places / Asking Where / keep_as_is; selected as 900 premium fill","approved"
"v900-dire-navi-i-think-i-went-the-wrong-way","directions-navigation","v900-dire-navi-i-think-i-went-the-wrong-way","I think I went the wrong way","Use this when you need to explain that i think i went the wrong way.","v900-dire-navi-i-think-i-went-the-wrong-way","I think I went the wrong way","Tôi nghĩ tôi đã đi sai đường","Tôi nghĩ tôi đã đi sai đường","Toi nghi toi da di sai duong","premium","say-first","Use this while walking, checking a route, or confirming the exact turn, stop, or entrance.","","i think i went the wrong way","","ready","🗺️","cleanup import: Directions & Places / Lost & Route Repair / keep_as_is; selected as 900 premium fill","approved"
"v900-dire-navi-which-entrance-should-i-use","directions-navigation","v900-dire-navi-which-entrance-should-i-use","Which entrance should I use","Ask this when you need which entrance should i use.","v900-dire-navi-which-entrance-should-i-use","Which entrance should I use?","Tôi nên sử dụng lối vào nào?","Tôi nên sử dụng lối vào nào?","Toi nen su dung loi vao nao","premium","say-first","Use this while walking, checking a route, or confirming the exact turn, stop, or entrance.","","which entrance should i use?|which entrance should i use","","ready","🗺️","cleanup import: Directions & Places / Entrances, Exits & Pickup Points / keep_as_is; selected as 900 premium fill","approved"
"v900-dire-navi-is-it-past-the-traffic-light","directions-navigation","v900-dire-navi-is-it-past-the-traffic-light","Is it past the traffic light","Ask this when you need is it past the traffic light.","v900-dire-navi-is-it-past-the-traffic-light","Is it past the traffic light?","Có vượt qua đèn giao thông không?","Có vượt qua đèn giao thông không?","Co vuot qua den giao thong khong","premium","say-first","Use this while walking, checking a route, or confirming the exact turn, stop, or entrance.","","is it past the traffic light?|is it past the traffic light","","ready","🗺️","cleanup import: Directions & Places / Walking Directions / keep_as_is; selected as 900 premium fill","approved"
"v900-dire-navi-where-should-the-driver-stop","directions-navigation","v900-dire-navi-where-should-the-driver-stop","Where should the driver stop","Ask this when you need where should the driver stop.","v900-dire-navi-where-should-the-driver-stop","Where should the driver stop?","Người lái xe nên dừng ở đâu?","Người lái xe nên dừng ở đâu?","Nguoi lai xe nen dung o dau","premium","say-first","Use this while walking, checking a route, or confirming the exact turn, stop, or entrance.","","where should the driver stop?|where should the driver stop","","ready","🗺️","cleanup import: Directions & Places / Entrances, Exits & Pickup Points / keep_as_is; selected as 900 premium fill","approved"
"v900-dire-navi-please-write-the-address-for-me","directions-navigation","v900-dire-navi-please-write-the-address-for-me","Please write the address for me","Use this when you need direct help with the next step.","v900-dire-navi-please-write-the-address-for-me","Please write the address for me","Hãy viết địa chỉ cho tôi","Hãy viết địa chỉ cho tôi","Hay viet dia chi cho toi","premium","say-first","Use this while walking, checking a route, or confirming the exact turn, stop, or entrance.","","please write the address for me","","ready","🗺️","cleanup import: Directions & Places / Lost & Route Repair / keep_as_is; selected as 900 premium fill","approved"
"v900-dire-navi-where-do-i-meet-the-tour-group","directions-navigation","v900-dire-navi-where-do-i-meet-the-tour-group","Where do I meet the tour group","Ask this when you need where do i meet the tour group.","v900-dire-navi-where-do-i-meet-the-tour-group","Where do I meet the tour group?","Tôi gặp nhóm du lịch ở đâu?","Tôi gặp nhóm du lịch ở đâu?","Toi gap nhom du lich o dau","premium","say-first","Use this while walking, checking a route, or confirming the exact turn, stop, or entrance.","","where do i meet the tour group?|where do i meet the tour group","","ready","🗺️","cleanup import: Directions & Places / Entrances, Exits & Pickup Points / keep_as_is; selected as 900 premium fill","approved"
"v900-dire-navi-what-time-does-this-place-close","directions-navigation","v900-dire-navi-what-time-does-this-place-close","What time does this place close","Ask this when you need what time does this place close.","v900-dire-navi-what-time-does-this-place-close","What time does this place close?","Nơi này đóng cửa lúc mấy giờ?","Nơi này đóng cửa lúc mấy giờ?","Noi nay dong cua luc may gio","premium","say-first","Use this while walking, checking a route, or confirming the exact turn, stop, or entrance.","","what time does this place close?|what time does this place close","","ready","🗺️","cleanup import: Directions & Places / Distance & Timing / keep_as_is; selected as 900 premium fill","approved"
"v900-dire-navi-where-is-the-exit-to-the-street","directions-navigation","v900-dire-navi-where-is-the-exit-to-the-street","Where is the exit to the street","Ask this when you need where is the exit to the street.","v900-dire-navi-where-is-the-exit-to-the-street","Where is the exit to the street?","Lối ra đường ở đâu?","Lối ra đường ở đâu?","Loi ra duong o dau","premium","say-first","Use this while walking, checking a route, or confirming the exact turn, stop, or entrance.","","where is the exit to the street?|where is the exit to the street","","ready","🗺️","cleanup import: Directions & Places / Entrances, Exits & Pickup Points / keep_as_is; selected as 900 premium fill","approved"
"v900-dire-navi-is-it-on-this-side-of-the-street","directions-navigation","v900-dire-navi-is-it-on-this-side-of-the-street","Is it on this side of the street","Ask this when you need is it on this side of the street.","v900-dire-navi-is-it-on-this-side-of-the-street","Is it on this side of the street?","Có phải ở phía bên này của đường phố?","Có phải ở phía bên này của đường phố?","Co phai o phia ben nay cua duong pho","premium","say-first","Use this while walking, checking a route, or confirming the exact turn, stop, or entrance.","","is it on this side of the street?|is it on this side of the street","","ready","🗺️","cleanup import: Directions & Places / Walking Directions / keep_as_is; selected as 900 premium fill","approved"
"v900-dire-navi-is-this-the-correct-pickup-point","directions-navigation","v900-dire-navi-is-this-the-correct-pickup-point","Is this the correct pickup point","Ask this when you need is this the correct pickup point.","v900-dire-navi-is-this-the-correct-pickup-point","Is this the correct pickup point?","Đây có phải là điểm đón chính xác không?","Đây có phải là điểm đón chính xác không?","Day co phai la diem don chinh xac khong","premium","say-first","Use this while walking, checking a route, or confirming the exact turn, stop, or entrance.","","is this the correct pickup point?|is this the correct pickup point","","ready","🗺️","cleanup import: Directions & Places / Entrances, Exits & Pickup Points / keep_as_is; selected as 900 premium fill","approved"
"v900-dire-navi-please-point-me-in-the-right-direction","directions-navigation","v900-dire-navi-please-point-me-in-the-right-direction","Please point me in the right direction","Use this when you need direct help with the next step.","v900-dire-navi-please-point-me-in-the-right-direction","Please point me in the right direction","Xin hãy chỉ cho tôi đi đúng hướng","Xin hãy chỉ cho tôi đi đúng hướng","Xin hay chi cho toi di dung huong","premium","say-first","Use this while walking, checking a route, or confirming the exact turn, stop, or entrance.","","please point me in the right direction","","ready","🗺️","cleanup import: Directions & Places / Walking Directions / keep_as_is; selected as 900 premium fill","approved"
"v900-dire-navi-where-is-the-nearest-information-desk","directions-navigation","v900-dire-navi-where-is-the-nearest-information-desk","Where is the nearest information desk","Ask this when you need where is the nearest information desk.","v900-dire-navi-where-is-the-nearest-information-desk","Where is the nearest information desk?","Bàn thông tin gần nhất ở đâu?","Bàn thông tin gần nhất ở đâu?","Ban thong tin gan nhat o dau","premium","say-first","Use this while walking, checking a route, or confirming the exact turn, stop, or entrance.","","where is the nearest information desk?|where is the nearest information desk","","ready","🗺️","cleanup import: Directions & Places / Asking Where / keep_as_is; selected as 900 premium fill","approved"
"v900-dire-navi-where-is-the-nearest-convenience-store","directions-navigation","v900-dire-navi-where-is-the-nearest-convenience-store","Where is the nearest convenience store","Ask this when you need where is the nearest convenience store.","v900-dire-navi-where-is-the-nearest-convenience-store","Where is the nearest convenience store?","Cửa hàng tiện lợi gần nhất ở đâu?","Cửa hàng tiện lợi gần nhất ở đâu?","Cua hang tien loi gan nhat o dau","premium","say-first","Use this while walking, checking a route, or confirming the exact turn, stop, or entrance.","","where is the nearest convenience store?|where is the nearest convenience store","","ready","🗺️","cleanup import: Directions & Places / Asking Where / keep_as_is; selected as 900 premium fill","approved"
"v900-dire-navi-is-this-the-old-location-or-the-new-one","directions-navigation","v900-dire-navi-is-this-the-old-location-or-the-new-one","Is this the old location or the new one","Ask this when you need is this the old location or the new one.","v900-dire-navi-is-this-the-old-location-or-the-new-one","Is this the old location or the new one?","Đây là địa điểm cũ hay địa điểm mới?","Đây là địa điểm cũ hay địa điểm mới?","Day la dia diem cu hay dia diem moi","premium","say-first","Use this while walking, checking a route, or confirming the exact turn, stop, or entrance.","","is this the old location or the new one?|is this the old location or the new one","","ready","🗺️","cleanup import: Directions & Places / Landmarks & Places / keep_as_is; selected as 900 premium fill","approved"
"v900-dire-navi-is-it-across-from-the-cafe","directions-navigation","v900-dire-navi-is-it-across-from-the-cafe","Is it across from the cafe","Ask this when you need is it across from the cafe.","v900-dire-navi-is-it-across-from-the-cafe","Is it across from the cafe?","Nó có ở đối diện quán cà phê không?","Nó có ở đối diện quán cà phê không?","No co o doi dien quan ca phe khong","premium","say-first","Use this while walking, checking a route, or confirming the exact turn, stop, or entrance.","","is it across from the cafe?|is it across from the cafe","","ready","🗺️","cleanup import: Directions & Places / Landmarks & Places / keep_rewrite; selected as 900 premium fill","approved"
"v900-dire-navi-how-long-does-it-take-by-taxi","directions-navigation","v900-dire-navi-how-long-does-it-take-by-taxi","How long does it take by taxi","Ask this when you need how long does it take by taxi.","v900-dire-navi-how-long-does-it-take-by-taxi","How long does it take by taxi?","Đi taxi mất bao lâu?","Đi taxi mất bao lâu?","Di taxi mat bao lau","premium","say-first","Use this while walking, checking a route, or confirming the exact turn, stop, or entrance.","","how long does it take by taxi?|how long does it take by taxi","","ready","🗺️","cleanup import: Directions & Places / Distance & Timing / keep_rewrite; selected as 900 premium fill","approved"
"v900-dire-navi-how-long-does-it-take-by-motorbike","directions-navigation","v900-dire-navi-how-long-does-it-take-by-motorbike","How long does it take by motorbike","Ask this when you need how long does it take by motorbike.","v900-dire-navi-how-long-does-it-take-by-motorbike","How long does it take by motorbike?","Đi xe máy mất bao lâu?","Đi xe máy mất bao lâu?","Di xe may mat bao lau","premium","say-first","Use this while walking, checking a route, or confirming the exact turn, stop, or entrance.","","how long does it take by motorbike?|how long does it take by motorbike","","ready","🗺️","cleanup import: Directions & Places / Distance & Timing / keep_rewrite; selected as 900 premium fill","approved"
"v900-dire-navi-can-you-point-out-a-nearby-landmark","directions-navigation","v900-dire-navi-can-you-point-out-a-nearby-landmark","Can you point out a nearby landmark","Ask this when you need can you point out a nearby landmark.","v900-dire-navi-can-you-point-out-a-nearby-landmark","Can you point out a nearby landmark?","Bạn có thể chỉ ra một điểm mốc gần đó không?","Bạn có thể chỉ ra một điểm mốc gần đó không?","Ban co the chi ra mot diem moc gan do khong","premium","say-first","Use this while walking, checking a route, or confirming the exact turn, stop, or entrance.","","can you point out a nearby landmark?|can you point out a nearby landmark","","ready","🗺️","cleanup import: Directions & Places / Landmarks & Places / keep_rewrite; selected as 900 premium fill","approved"
"v900-dire-navi-can-you-call-this-place-and-ask-for-directions","directions-navigation","v900-dire-navi-can-you-call-this-place-and-ask-for-directions","Can you call this place and ask for directions","Ask this when you need can you call this place and ask for directions.","v900-dire-navi-can-you-call-this-place-and-ask-for-directions","Can you call this place and ask for directions?","Bạn có thể gọi đến nơi này và hỏi đường được không?","Bạn có thể gọi đến nơi này và hỏi đường được không?","Ban co the goi den noi nay va hoi duong duoc khong","premium","say-first","Use this while walking, checking a route, or confirming the exact turn, stop, or entrance.","","can you call this place and ask for directions?|can you call this place and ask for directions","","ready","🗺️","cleanup import: Directions & Places / Lost & Route Repair / keep_rewrite; selected as 900 premium fill","approved"
"v900-airp-bord-arri-where-is-the-arrivals-hall","airport-border-arrival","v900-airp-bord-arri-where-is-the-arrivals-hall","Where is the arrivals hall","Ask this when you need where is the arrivals hall.","v900-airp-bord-arri-where-is-the-arrivals-hall","Where is the arrivals hall?","Sảnh đến ở đâu?","Sảnh đến ở đâu?","Sanh den o dau","premium","say-first","Use this during arrival, transfers, baggage, pickups, or airport services when you need the next checkpoint.","","where is the arrivals hall?|where is the arrivals hall","","ready","🛬","cleanup import: Airport & Arrival / Terminals, Gates & Onward Travel / keep_as_is; selected as 900 premium fill","approved"
"v900-airp-bord-arri-can-you-help-me-book-a-taxi","airport-border-arrival","v900-airp-bord-arri-can-you-help-me-book-a-taxi","Can you help me book a taxi","Ask this when you need can you help me book a taxi.","v900-airp-bord-arri-can-you-help-me-book-a-taxi","Can you help me book a taxi?","Bạn có thể giúp tôi đặt một chiếc taxi được không?","Bạn có thể giúp tôi đặt một chiếc taxi được không?","Ban co the giup toi dat mot chiec taxi duoc khong","premium","say-first","Use this during arrival, transfers, baggage, pickups, or airport services when you need the next checkpoint.","","can you help me book a taxi?|can you help me book a taxi","","ready","🛬","cleanup import: Airport & Arrival / Pickup, Taxi & Transfers / keep_as_is; selected as 900 premium fill","approved"
"v900-airp-bord-arri-i-made-a-mistake-on-the-form","airport-border-arrival","v900-airp-bord-arri-i-made-a-mistake-on-the-form","I made a mistake on the form","Use this when you need to explain that i made a mistake on the form.","v900-airp-bord-arri-i-made-a-mistake-on-the-form","I made a mistake on the form","Tôi đã mắc lỗi trong biểu mẫu","Tôi đã mắc lỗi trong biểu mẫu","Toi da mac loi trong bieu mau","premium","say-first","Use this during arrival, transfers, baggage, pickups, or airport services when you need the next checkpoint.","","i made a mistake on the form","","ready","🛬","cleanup import: Airport & Arrival / Immigration & Documents / keep_as_is; selected as 900 premium fill","approved"
"v900-airp-bord-arri-please-send-it-to-this-hotel","airport-border-arrival","v900-airp-bord-arri-please-send-it-to-this-hotel","Please send it to this hotel","Use this when you need direct help with the next step.","v900-airp-bord-arri-please-send-it-to-this-hotel","Please send it to this hotel","Vui lòng gửi nó đến khách sạn này","Vui lòng gửi nó đến khách sạn này","Vui long gui no den khach san nay","premium","say-first","Use this during arrival, transfers, baggage, pickups, or airport services when you need the next checkpoint.","","please send it to this hotel","","ready","🛬","cleanup import: Airport & Arrival / Baggage & Lost Luggage / keep_as_is; selected as 900 premium fill","approved"
"v900-airp-bord-arri-where-can-i-charge-my-phone","airport-border-arrival","v900-airp-bord-arri-where-can-i-charge-my-phone","Where can I charge my phone","Ask this when you need where can i charge my phone.","v900-airp-bord-arri-where-can-i-charge-my-phone","Where can I charge my phone?","Tôi có thể sạc điện thoại ở đâu?","Tôi có thể sạc điện thoại ở đâu?","Toi co the sac dien thoai o dau","premium","say-first","Use this during arrival, transfers, baggage, pickups, or airport services when you need the next checkpoint.","","where can i charge my phone?|where can i charge my phone","","ready","🛬","cleanup import: Airport & Arrival / Airport Services & Facilities / keep_as_is; selected as 900 premium fill","approved"
"v900-airp-bord-arri-where-is-the-departure-hall","airport-border-arrival","v900-airp-bord-arri-where-is-the-departure-hall","Where is the departure hall","Ask this when you need where is the departure hall.","v900-airp-bord-arri-where-is-the-departure-hall","Where is the departure hall?","Sảnh khởi hành ở đâu?","Sảnh khởi hành ở đâu?","Sanh khoi hanh o dau","premium","say-first","Use this during arrival, transfers, baggage, pickups, or airport services when you need the next checkpoint.","","where is the departure hall?|where is the departure hall","","ready","🛬","cleanup import: Airport & Arrival / Terminals, Gates & Onward Travel / keep_as_is; selected as 900 premium fill","approved"
"v900-airp-bord-arri-can-i-pay-the-driver-by-card","airport-border-arrival","v900-airp-bord-arri-can-i-pay-the-driver-by-card","Can I pay the driver by card","Ask this when you need can i pay the driver by card.","v900-airp-bord-arri-can-i-pay-the-driver-by-card","Can I pay the driver by card?","Tôi có thể thanh toán cho tài xế bằng thẻ không?","Tôi có thể thanh toán cho tài xế bằng thẻ không?","Toi co the thanh toan cho tai xe bang the khong","premium","say-first","Use this during arrival, transfers, baggage, pickups, or airport services when you need the next checkpoint.","","can i pay the driver by card?|can i pay the driver by card","","ready","🛬","cleanup import: Airport & Arrival / Pickup, Taxi & Transfers / keep_as_is; selected as 900 premium fill","approved"
"v900-airp-bord-arri-can-you-help-me-track-my-bag","airport-border-arrival","v900-airp-bord-arri-can-you-help-me-track-my-bag","Can you help me track my bag","Ask this when you need can you help me track my bag.","v900-airp-bord-arri-can-you-help-me-track-my-bag","Can you help me track my bag?","Bạn có thể giúp tôi theo dõi túi của tôi?","Bạn có thể giúp tôi theo dõi túi của tôi?","Ban co the giup toi theo doi tui cua toi","premium","say-first","Use this during arrival, transfers, baggage, pickups, or airport services when you need the next checkpoint.","","can you help me track my bag?|can you help me track my bag","","ready","🛬","cleanup import: Airport & Arrival / Baggage & Lost Luggage / keep_as_is; selected as 900 premium fill","approved"
"v900-airp-bord-arri-please-call-this-driver-for-me","airport-border-arrival","v900-airp-bord-arri-please-call-this-driver-for-me","Please call this driver for me","Use this when you need direct help with the next step.","v900-airp-bord-arri-please-call-this-driver-for-me","Please call this driver for me","Hãy gọi tài xế này cho tôi","Hãy gọi tài xế này cho tôi","Hay goi tai xe nay cho toi","premium","say-first","Use this during arrival, transfers, baggage, pickups, or airport services when you need the next checkpoint.","","please call this driver for me","","ready","🛬","cleanup import: Airport & Arrival / Pickup, Taxi & Transfers / keep_as_is; selected as 900 premium fill","approved"
