"phrase_id","scenario_id","family_id","family_title","family_summary","audio_key","english_text","target_text","canonical_target_text","pronunciation","access_tier","variant_role","context","you_may_hear","search_aliases","warning_note_type","audio_status","emoji","notes","status"
"v500-tran-please-drive-slower","transport","v500-tran-please-drive-slower","Please drive slower","Use this when you need direct help with the next step.","v500-tran-please-drive-slower","Please drive slower","Xin hãy lái xe chậm lại","Xin hãy lái xe chậm lại","Xin hay lai xe cham lai","premium","say-first","Use this during rides, stations, pickups, or route changes when the trip could go sideways.","","please drive slower","","ready","🚕","autonomous-500 from cleanup: Getting Around / Comfort, Waiting & Stops / keep_as_is; selected as premium fill","approved"
"v500-tran-please-follow-the-map","transport","v500-tran-please-follow-the-map","Please follow the map","Use this when you need direct help with the next step.","v500-tran-please-follow-the-map","Please follow the map","Hãy đi theo bản đồ","Hãy đi theo bản đồ","Hay di theo ban do","premium","say-first","Use this during rides, stations, pickups, or route changes when the trip could go sideways.","","please follow the map","","ready","🚕","autonomous-500 from cleanup: Getting Around / Taxi & Ride-Hailing / keep_as_is; selected as premium fill","approved"
"v500-tran-please-open-the-trunk","transport","v500-tran-please-open-the-trunk","Please open the trunk","Use this when you need direct help with the next step.","v500-tran-please-open-the-trunk","Please open the trunk","Vui lòng mở cốp xe","Vui lòng mở cốp xe","Vui long mo cop xe","premium","say-first","Use this during rides, stations, pickups, or route changes when the trip could go sideways.","","please open the trunk","","ready","🚕","autonomous-500 from cleanup: Getting Around / Taxi & Ride-Hailing / keep_as_is; selected as premium fill","approved"
"v500-tran-when-is-the-next-bus","transport","v500-tran-when-is-the-next-bus","When is the next bus","Ask this when you need when is the next bus.","v500-tran-when-is-the-next-bus","When is the next bus?","Khi nào có chuyến xe buýt tiếp theo?","Khi nào có chuyến xe buýt tiếp theo?","Khi nao co chuyen xe buyt tiep theo","premium","say-first","Use this during rides, stations, pickups, or route changes when the trip could go sideways.","","when is the next bus?|when is the next bus","","ready","🚕","autonomous-500 from cleanup: Getting Around / Bus, Train & Metro / keep_as_is; selected as premium fill","approved"
"v500-tran-where-do-i-return-it","transport","v500-tran-where-do-i-return-it","Where do I return it","Ask this when you need where do i return it.","v500-tran-where-do-i-return-it","Where do I return it?","Tôi có thể trả lại nó ở đâu?","Tôi có thể trả lại nó ở đâu?","Toi co the tra lai no o dau","premium","say-first","Use this during rides, stations, pickups, or route changes when the trip could go sideways.","","where do i return it?|where do i return it","","ready","🚕","autonomous-500 from cleanup: Getting Around / Motorbike, Boat & Rentals / keep_as_is; selected as premium fill","approved"
"v500-tran-can-i-put-my-bag-here","transport","v500-tran-can-i-put-my-bag-here","Can I put my bag here","Ask this when you need can i put my bag here.","v500-tran-can-i-put-my-bag-here","Can I put my bag here?","Tôi có thể đặt túi của tôi ở đây được không?","Tôi có thể đặt túi của tôi ở đây được không?","Toi co the dat tui cua toi o day duoc khong","premium","say-first","Use this during rides, stations, pickups, or route changes when the trip could go sideways.","","can i put my bag here?|can i put my bag here","","ready","🚕","autonomous-500 from cleanup: Getting Around / Bus, Train & Metro / keep_as_is; selected as premium fill","approved"
"v500-tran-i-got-on-the-wrong-bus","transport","v500-tran-i-got-on-the-wrong-bus","I got on the wrong bus","Use this when you need to explain that i got on the wrong bus.","v500-tran-i-got-on-the-wrong-bus","I got on the wrong bus","Tôi lên nhầm xe buýt","Tôi lên nhầm xe buýt","Toi len nham xe buyt","premium","say-first","Use this during rides, stations, pickups, or route changes when the trip could go sideways.","","i got on the wrong bus","","ready","🚕","autonomous-500 from cleanup: Getting Around / Bus, Train & Metro / keep_as_is; selected as premium fill","approved"
"v500-tran-is-this-train-delayed","transport","v500-tran-is-this-train-delayed","Is this train delayed","Ask this when you need is this train delayed.","v500-tran-is-this-train-delayed","Is this train delayed?","Chuyến tàu này có bị trễ không?","Chuyến tàu này có bị trễ không?","Chuyen tau nay co bi tre khong","premium","say-first","Use this during rides, stations, pickups, or route changes when the trip could go sideways.","","is this train delayed?|is this train delayed","","ready","🚕","autonomous-500 from cleanup: Getting Around / Bus, Train & Metro / keep_as_is; selected as premium fill","approved"
"v500-tran-please-call-the-driver","transport","v500-tran-please-call-the-driver","Please call the driver","Use this when you need direct help with the next step.","v500-tran-please-call-the-driver","Please call the driver","Vui lòng gọi tài xế","Vui lòng gọi tài xế","Vui long goi tai xe","premium","say-first","Use this during rides, stations, pickups, or route changes when the trip could go sideways.","","please call the driver","","ready","🚕","autonomous-500 from cleanup: Getting Around / Transport Problems & Recovery / keep_as_is; selected as premium fill","approved"
"v500-tran-please-drive-carefully","transport","v500-tran-please-drive-carefully","Please drive carefully","Use this when you need direct help with the next step.","v500-tran-please-drive-carefully","Please drive carefully","Hãy lái xe cẩn thận","Hãy lái xe cẩn thận","Hay lai xe can than","premium","say-first","Use this during rides, stations, pickups, or route changes when the trip could go sideways.","","please drive carefully","","ready","🚕","autonomous-500 from cleanup: Getting Around / Comfort, Waiting & Stops / keep_as_is; selected as premium fill","approved"
"v500-tran-please-lower-the-music","transport","v500-tran-please-lower-the-music","Please lower the music","Use this when you need direct help with the next step.","v500-tran-please-lower-the-music","Please lower the music","Làm ơn giảm nhạc đi","Làm ơn giảm nhạc đi","Lam on giam nhac di","premium","say-first","Use this during rides, stations, pickups, or route changes when the trip could go sideways.","","please lower the music","","ready","🚕","autonomous-500 from cleanup: Getting Around / Comfort, Waiting & Stops / keep_as_is; selected as premium fill","approved"
"v500-hote-acco-the-electricity-is-out","hotel-accommodation","v500-hote-acco-the-electricity-is-out","The electricity is out","Use this when you need to say the electricity is out.","v500-hote-acco-the-electricity-is-out","The electricity is out","Điện đã hết","Điện đã hết","Dien da het","premium","say-first","Use this at the front desk or in the room when you need the hotel to fix the next step.","","the electricity is out","","ready","🏨","autonomous-500 from cleanup: Hotel & Accommodation / Room Problems / keep_as_is; selected as premium fill","approved"
"v500-hote-acco-can-someone-come-fix-it","hotel-accommodation","v500-hote-acco-can-someone-come-fix-it","Can someone come fix it","Ask this when you need can someone come fix it.","v500-hote-acco-can-someone-come-fix-it","Can someone come fix it?","Ai đó có thể đến sửa nó được không?","Ai đó có thể đến sửa nó được không?","Ai do co the den sua no duoc khong","premium","say-first","Use this at the front desk or in the room when you need the hotel to fix the next step.","","can someone come fix it?|can someone come fix it","","ready","🏨","autonomous-500 from cleanup: Hotel & Accommodation / Room Problems / keep_as_is; selected as premium fill","approved"
"v500-hote-acco-the-toilet-is-not-working","hotel-accommodation","v500-hote-acco-the-toilet-is-not-working","The toilet is not working","Use this when you need to say the toilet is not working.","v500-hote-acco-the-toilet-is-not-working","The toilet is not working","Nhà vệ sinh không hoạt động","Nhà vệ sinh không hoạt động","Nha ve sinh khong hoat dong","premium","say-first","Use this at the front desk or in the room when you need the hotel to fix the next step.","","the toilet is not working","","ready","🏨","autonomous-500 from cleanup: Hotel & Accommodation / Room Problems / keep_as_is; selected as premium fill","approved"
"v500-hote-acco-here-is-my-passport-for-check-in","hotel-accommodation","v500-hote-acco-here-is-my-passport-for-check-in","Here is my passport for check-in","Use this when you need to say here is my passport for check-in.","v500-hote-acco-here-is-my-passport-for-check-in","Here is my passport for check-in","Đây là hộ chiếu của tôi để nhận phòng","Đây là hộ chiếu của tôi để nhận phòng","Day la ho chieu cua toi de nhan phong","premium","say-first","Use this at the front desk or in the room when you need the hotel to fix the next step.","","here is my passport for check-in|here is my passport for check in","","ready","🏨","autonomous-500 from cleanup: Hotel & Accommodation / Check-In & Reservation / keep_as_is; selected as premium fill","approved"
"v500-hote-acco-can-i-pay-now","hotel-accommodation","v500-hote-acco-can-i-pay-now","Can I pay now","Ask this when you need can i pay now.","v500-hote-acco-can-i-pay-now","Can I pay now?","Tôi có thể thanh toán bây giờ được không?","Tôi có thể thanh toán bây giờ được không?","Toi co the thanh toan bay gio duoc khong","premium","say-first","Use this at the front desk or in the room when you need the hotel to fix the next step.","","can i pay now?|can i pay now","","ready","🏨","autonomous-500 from cleanup: Hotel & Accommodation / Checkout, Extensions & Payment / keep_as_is; selected as premium fill","approved"
"v500-hote-acco-i-booked-online","hotel-accommodation","v500-hote-acco-i-booked-online","I booked online","Use this when you need to explain that i booked online.","v500-hote-acco-i-booked-online","I booked online","Tôi đã đặt trực tuyến","Tôi đã đặt trực tuyến","Toi da dat truc tuyen","premium","say-first","Use this at the front desk or in the room when you need the hotel to fix the next step.","","i booked online","","ready","🏨","autonomous-500 from cleanup: Hotel & Accommodation / Check-In & Reservation / keep_as_is; selected as premium fill","approved"
"v500-hote-acco-can-i-change-rooms","hotel-accommodation","v500-hote-acco-can-i-change-rooms","Can I change rooms","Ask this when you need can i change rooms.","v500-hote-acco-can-i-change-rooms","Can I change rooms?","Tôi có thể đổi phòng được không?","Tôi có thể đổi phòng được không?","Toi co the doi phong duoc khong","premium","say-first","Use this at the front desk or in the room when you need the hotel to fix the next step.","","can i change rooms?|can i change rooms","","ready","🏨","autonomous-500 from cleanup: Hotel & Accommodation / Room Problems / keep_as_is; selected as premium fill","approved"
"v500-hote-acco-can-i-have-an-iron","hotel-accommodation","v500-hote-acco-can-i-have-an-iron","Can I have an iron","Ask this when you need can i have an iron.","v500-hote-acco-can-i-have-an-iron","Can I have an iron?","Tôi có thể có một cái bàn ủi được không?","Tôi có thể có một cái bàn ủi được không?","Toi co the co mot cai ban ui duoc khong","premium","say-first","Use this at the front desk or in the room when you need the hotel to fix the next step.","","can i have an iron?|can i have an iron","","ready","🏨","autonomous-500 from cleanup: Hotel & Accommodation / Housekeeping & Supplies / keep_as_is; selected as premium fill","approved"
"v500-hote-acco-can-i-check-in-early","hotel-accommodation","v500-hote-acco-can-i-check-in-early","Can I check in early","Ask this when you need can i check in early.","v500-hote-acco-can-i-check-in-early","Can I check in early?","Tôi có thể nhận phòng sớm được không?","Tôi có thể nhận phòng sớm được không?","Toi co the nhan phong som duoc khong","premium","say-first","Use this at the front desk or in the room when you need the hotel to fix the next step.","","can i check in early?|can i check in early","","ready","🏨","autonomous-500 from cleanup: Hotel & Accommodation / Check-In & Reservation / keep_as_is; selected as premium fill","approved"
"v500-hote-acco-can-i-check-out-late","hotel-accommodation","v500-hote-acco-can-i-check-out-late","Can I check out late","Ask this when you need can i check out late.","v500-hote-acco-can-i-check-out-late","Can I check out late?","Tôi có thể trả phòng muộn được không?","Tôi có thể trả phòng muộn được không?","Toi co the tra phong muon duoc khong","premium","say-first","Use this at the front desk or in the room when you need the hotel to fix the next step.","","can i check out late?|can i check out late","","ready","🏨","autonomous-500 from cleanup: Hotel & Accommodation / Checkout, Extensions & Payment / keep_as_is; selected as premium fill","approved"
"v500-hote-acco-can-i-have-more-soap","hotel-accommodation","v500-hote-acco-can-i-have-more-soap","Can I have more soap","Ask this when you need can i have more soap.","v500-hote-acco-can-i-have-more-soap","Can I have more soap?","Tôi có thể lấy thêm xà phòng được không?","Tôi có thể lấy thêm xà phòng được không?","Toi co the lay them xa phong duoc khong","premium","say-first","Use this at the front desk or in the room when you need the hotel to fix the next step.","","can i have more soap?|can i have more soap","","ready","🏨","autonomous-500 from cleanup: Hotel & Accommodation / Housekeeping & Supplies / keep_as_is; selected as premium fill","approved"
"v500-hote-acco-the-room-is-not-clean","hotel-accommodation","v500-hote-acco-the-room-is-not-clean","The room is not clean","Use this when you need to say the room is not clean.","v500-hote-acco-the-room-is-not-clean","The room is not clean","Phòng không sạch sẽ","Phòng không sạch sẽ","Phong khong sach se","premium","say-first","Use this at the front desk or in the room when you need the hotel to fix the next step.","","the room is not clean","","ready","🏨","autonomous-500 from cleanup: Hotel & Accommodation / Complaints, Changes & Refunds / keep_as_is; selected as premium fill","approved"
"v500-hote-acco-the-room-is-too-noisy","hotel-accommodation","hotel-too-noisy","Say the room is too noisy","Noise is a real hotel failure and often needs a room move or staff action.","v500-hote-acco-the-room-is-too-noisy","I cannot sleep because it is too noisy","Tôi không thể ngủ được vì quá ồn ào","Tôi không thể ngủ được vì quá ồn ào","Toi khong the ngu duoc vi qua on ao","premium","clearer","Use this when outside noise, neighbors, or hotel noise is making the room unusable.","","cannot sleep because of the noise|too noisy to sleep","","ready","🏨","autonomous-500 duplicate cleanup: merged into hotel-too-noisy as a clearer non-primary variant during the 900-family pass","approved"
"v500-hote-acco-there-is-no-hot-water","hotel-accommodation","hotel-no-hot-water","Report that there is no hot water","This is a common room-recovery problem and a believable premium follow-up beyond basic check-in.","v500-hote-acco-there-is-no-hot-water","The shower only has cold water","Vòi sen chỉ có nước lạnh","Vòi sen chỉ có nước lạnh","Voi sen chi co nuoc lanh","premium","clearer","Use this when the shower or sink water is cold and you need the hotel to fix it.","","cold water only|shower only has cold water","","ready","🏨","autonomous-500 duplicate cleanup: merged into hotel-no-hot-water as a clearer non-primary variant during the 900-family pass","approved"
"v900-hote-acco-the-shower-is-not-working","hotel-accommodation","v900-hote-acco-the-shower-is-not-working","The shower is not working","Use this when the shower is broken, not just cold or draining badly.","v900-hote-acco-the-shower-is-not-working","The shower is not working","Vòi hoa sen không hoạt động","Vòi hoa sen không hoạt động","Voi hoa sen khong hoat dong","premium","say-first","Use this at the front desk or in the room when you need the hotel to fix the next step.","","the shower is not working|broken shower","","ready","🏨","manual 900 duplicate replacement: added after cleaning duplicate hotel anchor","approved"
"v900-hote-acco-the-water-pressure-is-too-low","hotel-accommodation","v900-hote-acco-the-water-pressure-is-too-low","The water pressure is too low","Use this when the water runs, but it is too weak to use the shower or sink properly.","v900-hote-acco-the-water-pressure-is-too-low","The water pressure is too low","Áp lực nước quá thấp","Áp lực nước quá thấp","Ap luc nuoc qua thap","premium","say-first","Use this at the front desk or in the room when you need the hotel to fix the next step.","","water pressure too low|low water pressure","","ready","🏨","manual 900 duplicate replacement: added after cleaning duplicate hotel anchor","approved"
"v500-hote-acco-do-you-need-a-deposit","hotel-accommodation","v500-hote-acco-do-you-need-a-deposit","Do you need a deposit","Ask this when you need do you need a deposit.","v500-hote-acco-do-you-need-a-deposit","Do you need a deposit?","Bạn có cần đặt cọc không?","Bạn có cần đặt cọc không?","Ban co can dat coc khong","premium","say-first","Use this at the front desk or in the room when you need the hotel to fix the next step.","","do you need a deposit?|do you need a deposit","","ready","🏨","autonomous-500 from cleanup: Hotel & Accommodation / Check-In & Reservation / keep_as_is; selected as premium fill","approved"
"v500-hote-acco-is-breakfast-included","hotel-accommodation","v500-hote-acco-is-breakfast-included","Is breakfast included","Ask this when you need is breakfast included.","v500-hote-acco-is-breakfast-included","Is breakfast included?","Có bao gồm bữa sáng không?","Có bao gồm bữa sáng không?","Co bao gom bua sang khong","premium","say-first","Use this at the front desk or in the room when you need the hotel to fix the next step.","","is breakfast included?|is breakfast included","","ready","🏨","autonomous-500 from cleanup: Hotel & Accommodation / Check-In & Reservation / keep_as_is; selected as premium fill","approved"
"v500-hote-acco-please-remove-the-trash","hotel-accommodation","v500-hote-acco-please-remove-the-trash","Please remove the trash","Use this when you need direct help with the next step.","v500-hote-acco-please-remove-the-trash","Please remove the trash","Vui lòng loại bỏ thùng rác","Vui lòng loại bỏ thùng rác","Vui long loai bo thung rac","premium","say-first","Use this at the front desk or in the room when you need the hotel to fix the next step.","","please remove the trash","","ready","🏨","autonomous-500 from cleanup: Hotel & Accommodation / Housekeeping & Supplies / keep_as_is; selected as premium fill","approved"
"v500-hote-acco-the-safe-is-not-opening","hotel-accommodation","v500-hote-acco-the-safe-is-not-opening","The safe is not opening","Use this when you need to say the safe is not opening.","v500-hote-acco-the-safe-is-not-opening","The safe is not opening","két sắt không mở được","két sắt không mở được","ket sat khong mo duoc","premium","say-first","Use this at the front desk or in the room when you need the hotel to fix the next step.","","the safe is not opening","","ready","🏨","autonomous-500 from cleanup: Hotel & Accommodation / Room Problems / keep_as_is; selected as premium fill","approved"
"v500-hote-acco-what-time-is-breakfast","hotel-accommodation","v500-hote-acco-what-time-is-breakfast","What time is breakfast","Ask this when you need what time is breakfast.","v500-hote-acco-what-time-is-breakfast","What time is breakfast?","Bữa sáng lúc mấy giờ?","Bữa sáng lúc mấy giờ?","Bua sang luc may gio","premium","say-first","Use this at the front desk or in the room when you need the hotel to fix the next step.","","what time is breakfast?|what time is breakfast","","ready","🏨","autonomous-500 from cleanup: Hotel & Accommodation / Check-In & Reservation / keep_as_is; selected as premium fill","approved"
"v500-food-drin-this-tastes-spoiled","food-drink","v500-food-drin-this-tastes-spoiled","This tastes spoiled","Use this when you need to say this tastes spoiled.","v500-food-drin-this-tastes-spoiled","This tastes spoiled","Cái này có vị hư hỏng","Cái này có vị hư hỏng","Cai nay co vi hu hong","premium","say-first","Use this while ordering, correcting the dish, or paying when the table moment needs a direct phrase.","","this tastes spoiled","","ready","🍽️","autonomous-500 from cleanup: Food & Drink / Order Problems & Recovery / keep_as_is; selected as premium fill","approved"
"v500-food-drin-does-this-contain-shrimp","food-drink","v500-food-drin-does-this-contain-shrimp","Does this contain shrimp","Ask this when you need does this contain shrimp.","v500-food-drin-does-this-contain-shrimp","Does this contain shrimp?","Cái này có chứa tôm không?","Cái này có chứa tôm không?","Cai nay co chua tom khong","premium","say-first","Use this while ordering, correcting the dish, or paying when the table moment needs a direct phrase.","","does this contain shrimp?|does this contain shrimp","","ready","🍽️","autonomous-500 from cleanup: Food & Drink / Dietary Needs & Allergies / keep_as_is; selected as premium fill","approved"
"v500-food-drin-does-this-contain-peanuts","food-drink","v500-food-drin-does-this-contain-peanuts","Does this contain peanuts","Ask this when you need does this contain peanuts.","v500-food-drin-does-this-contain-peanuts","Does this contain peanuts?","Cái này có chứa đậu phộng không?","Cái này có chứa đậu phộng không?","Cai nay co chua dau phong khong","premium","say-first","Use this while ordering, correcting the dish, or paying when the table moment needs a direct phrase.","","does this contain peanuts?|does this contain peanuts","","ready","🍽️","autonomous-500 from cleanup: Food & Drink / Dietary Needs & Allergies / keep_as_is; selected as premium fill","approved"
"v500-food-drin-i-am-allergic-to-shellfish","food-drink","v500-food-drin-i-am-allergic-to-shellfish","I am allergic to shellfish","Use this when you need to explain that i am allergic to shellfish.","v500-food-drin-i-am-allergic-to-shellfish","I am allergic to shellfish","Tôi bị dị ứng với động vật có vỏ","Tôi bị dị ứng với động vật có vỏ","Toi bi di ung voi dong vat co vo","premium","say-first","Use this while ordering, correcting the dish, or paying when the table moment needs a direct phrase.","","i am allergic to shellfish","","ready","🍽️","autonomous-500 from cleanup: Food & Drink / Dietary Needs & Allergies / keep_as_is; selected as premium fill","approved"
"v500-food-drin-id-like-a-b-nh-m-please","food-drink","v500-food-drin-id-like-a-b-nh-m-please","I’d like a bánh mì, please","Use this when you need to explain that i’d like a bánh mì, please.","v500-food-drin-id-like-a-b-nh-m-please","I’d like a bánh mì, please","Làm ơn cho tôi một cái bánh mì","Làm ơn cho tôi một cái bánh mì","Lam on cho toi mot cai banh mi","premium","say-first","Use this while ordering, correcting the dish, or paying when the table moment needs a direct phrase.","","i’d like a bánh mì, please|i d like a b nh m please","","ready","🍽️","autonomous-500 from cleanup: Food & Drink / Ordering Food / keep_as_is; selected as premium fill","approved"
"v500-food-drin-i-am-allergic-to-fish-sauce","food-drink","v500-food-drin-i-am-allergic-to-fish-sauce","I am allergic to fish sauce","Use this when you need to explain that i am allergic to fish sauce.","v500-food-drin-i-am-allergic-to-fish-sauce","I am allergic to fish sauce","Tôi bị dị ứng với nước mắm","Tôi bị dị ứng với nước mắm","Toi bi di ung voi nuoc mam","premium","say-first","Use this while ordering, correcting the dish, or paying when the table moment needs a direct phrase.","","i am allergic to fish sauce","","ready","🍽️","autonomous-500 from cleanup: Food & Drink / Dietary Needs & Allergies / keep_as_is; selected as premium fill","approved"
"v500-food-drin-there-is-something-in-my-food","food-drink","v500-food-drin-there-is-something-in-my-food","There is something in my food","Use this when you need to say there is something in my food.","v500-food-drin-there-is-something-in-my-food","There is something in my food","Có thứ gì đó trong thức ăn của tôi","Có thứ gì đó trong thức ăn của tôi","Co thu gi do trong thuc an cua toi","premium","say-first","Use this while ordering, correcting the dish, or paying when the table moment needs a direct phrase.","","there is something in my food","","ready","🍽️","autonomous-500 from cleanup: Food & Drink / Order Problems & Recovery / keep_as_is; selected as premium fill","approved"
